Url,Title,H1,Description,Keyword
https://icons.getbootstrap.com/,Bootstrap Icons · Official open source SVG icon library for Bootstrap,Bootstrap Icons,Official open source SVG icon library for Bootstrap,
https://www.siatexmail.com/,SiATee Apparel | Clothing Manufacturer Bangladesh&comma; T-shirts Supplier&comma; Polo Shirts Manufacturer,Clothing Manufacturer in Bangladesh,Custom Printed T-shirts Supplier&comma; jogging suits&comma; polo shirts&comma; pyjama sets&comma; sweatshirts&comma; t-shirts&comma; fleece&comma; shorts&comma; sports clothing&comma; tracksuits&comma; clothing&comma; women clothing&comma; men clothing&comma; kids clothing&comma; garments&comma; underwear&comma; ladies underwear&comma; clothes&comma; dress&comma; jackets&comma; jersey jackets&comma; jersey pants&comma; knitted wear&comma; knitwear&comma; ladies dresses&comma; ladies garments&comma; ladies tops&comma; ladies wear&comma; mens tops&comma; menswear&comma; outerwear&comma; outerwear men&comma; outerwear women&comma; skirts&comma; apparels&comma; woman clothing&comma; man clothing&comma; office wears&comma; polo t-shirts&comma; shirts&comma; trousers&comma; pants&comma; beachwear&comma; lingerie&comma; blouses&comma; ladies clothing&comma; mens clothing&comma; long sleeve shirts&comma; shirts men&comma; shirts women&comma; jackets women&comma; womens tops&comma; jeans&comma; jogging pants&comma; vests&comma; knitted t-shirts&comma; cardigans&comma; t-shirt&comma; sweatshirt&comma; pyjamas&comma; polo shirt&comma; wear clothing&comma; top wear&comma; shirt&comma; pajamas&comma; printed sweatshirts&comma; printed t-shirt&comma; skirt&comma; casual shirts&comma; sweaters&comma; denim wear&comma; promotion textile products&comma; promotional products&comma; fleece jackets&comma; raincoats&comma; towels&comma; school wear&comma; work wear&comma; jacket&comma; college jacket&comma; high visibility wear&comma; sweatsuit&comma; school wears&comma; work wears&comma; school dress&comma; school dresses&comma; work dress&comma; work dresses&comma; sweat shirts&comma; training suits&comma; school pants&comma; college jackets&comma; college shirts&comma; ready wear&comma; fancy t-shirts&comma; leggings&comma; dresses&comma; nightwear&comma; baby clothes&comma; towel&comma; man shirts&comma; men shirts&comma; shirts man&comma; woman shirts&comma; women shorts&comma; shirts woman&comma; long-sleeved shirts&comma; short-sleeved shirts&comma; checkered shirts&comma; dress shirts&comma; stripe shirts&comma; tee shirts&comma; scotch plaid shirts&comma; school uniforms&comma; fleeces&comma; ladies top&comma; Viscose Bamboo T-Shirt Manufacturers&comma; Bangladesh T-shirt Printing&comma; Bangladesh Garments Factories&comma; Private Label Clothing Manufacturer&comma; Custom T-Shirt Printing&comma; Promotional Corporate Apparels&comma; Promo Clothing Supplier&comma; Chino Pant Manufacturer Bangladesh&comma; Best Factory for Custom Printed T-shirts&comma; Branded Clothing Supplier&comma; Men's 3-Pack T-Shirt suppliers&comma; Knitwear Factory for T-shirts&comma; PROMOWEAR SUBLIMATED T-SHIRT&comma; Promotional Custom Clothing Manufacturers Bangladesh&comma; Promotion Apparel Factory&comma; High quality t-shirts manufacturers&comma; High quality sweatshirts manufacturers&comma; High quality hoodies manufacturers&comma; High quality polo shirts manufacturers&comma; High quality pajamas manufacturers&comma; High quality workwear manufacturers&comma; High quality uniforms manufacturers&comma; High quality children swear manufacturers&comma; Custom Work wear Manufacturer,Custom Printed T-shirts Supplier&comma; jogging suits&comma; polo shirts&comma; pyjama sets&comma; sweatshirts&comma; t-shirts&comma; fleece&comma; shorts&comma; sports clothing&comma; tracksuits&comma; clothing&comma; women clothing&comma; men clothing&comma; kids clothing&comma; garments&comma; underwear&comma; ladies underwear&comma; clothes&comma; dress&comma; jackets&comma; jersey jackets&comma; jersey pants&comma; knitted wear&comma; knitwear&comma; ladies dresses&comma; ladies garments&comma; ladies tops&comma; ladies wear&comma; mens tops&comma; menswear&comma; outerwear&comma; outerwear men&comma; outerwear women&comma; skirts&comma; apparels&comma; woman clothing&comma; man clothing&comma; office wears&comma; polo t-shirts&comma; shirts&comma; trousers&comma; pants&comma; beachwear&comma; lingerie&comma; blouses&comma; ladies clothing&comma; mens clothing&comma; long sleeve shirts&comma; shirts men&comma; shirts women&comma; jackets women&comma; womens tops&comma; jeans&comma; jogging pants&comma; vests&comma; knitted t-shirts&comma; cardigans&comma; t-shirt&comma; sweatshirt&comma; pyjamas&comma; polo shirt&comma; wear clothing&comma; top wear&comma; shirt&comma; pajamas&comma; printed sweatshirts&comma; printed t-shirt&comma; skirt&comma; casual shirts&comma; sweaters&comma; denim wear&comma; promotion textile products&comma; promotional products&comma; fleece jackets&comma; raincoats&comma; towels&comma; school wear&comma; work wear&comma; jacket&comma; college jacket&comma; high visibility wear&comma; sweatsuit&comma; school wears&comma; work wears&comma; school dress&comma; school dresses&comma; work dress&comma; work dresses&comma; sweat shirts&comma; training suits&comma; school pants&comma; college jackets&comma; college shirts&comma; ready wear&comma; fancy t-shirts&comma; leggings&comma; dresses&comma; nightwear&comma; baby clothes&comma; towel&comma; man shirts&comma; men shirts&comma; shirts man&comma; woman shirts&comma; women shorts&comma; shirts woman&comma; long-sleeved shirts&comma; short-sleeved shirts&comma; checkered shirts&comma; dress shirts&comma; stripe shirts&comma; tee shirts&comma; scotch plaid shirts&comma; school uniforms&comma; fleeces&comma; ladies top&comma; Viscose Bamboo T-Shirt Manufacturers&comma; Bangladesh T-shirt Printing&comma; Bangladesh Garments Factories&comma; Private Label Clothing Manufacturer&comma; Custom T-Shirt Printing&comma; Promotional Corporate Apparels&comma; Promo Clothing Supplier&comma; Chino Pant Manufacturer Bangladesh&comma; Best Factory for Custom Printed T-shirts&comma; Branded Clothing Supplier&comma; Men's 3-Pack T-Shirt suppliers&comma; Knitwear Factory for T-shirts&comma; PROMOWEAR SUBLIMATED T-SHIRT&comma; Promotional Custom Clothing Manufacturers Bangladesh&comma; Promotion Apparel Factory&comma; High quality t-shirts manufacturers&comma; High quality sweatshirts manufacturers&comma; High quality hoodies manufacturers&comma; High quality polo shirts manufacturers&comma; High quality pajamas manufacturers&comma; High quality workwear manufacturers&comma; High quality uniforms manufacturers&comma; High quality children swear manufacturers&comma; Custom Work wear Manufacturer
